Massachusetts Institute of Technology, United States
Stanford University, United States
Harvard University, United States
University of California, Berkeley, United States
Cornell University, United States
Columbia University in the City of New York, United States
University of Michigan, United States
Penn State University, United States
The University of Texas at Austin, United States
University of Washington, United States
University of Minnesota, United States
University of Pennsylvania, United States
University of California, Los Angeles, United States
Yale University, United States
Princeton University, United States
University of Wisconsin-Madison, United States
Purdue University, United States
Carnegie Mellon University, United States
New York University, United States
Michigan State University, United States
University of Oxford, United Kingdom
Universidad Nacional Autónoma de México, Mexico
University of Cambridge, United Kingdom
University of Florida, United States
University of Maryland, United States
University of California, San Diego, United States
University of North Carolina at Chapel Hill, United States
University of Virginia, United States
University of Arizona, United States
Texas A&M University, United States
University of Chicago, United States
University of Southern California, United States
Rutgers, The State University of New Jersey, United States
Universidade de São Paulo, Brazil
University of California, Davis, United States
University of Illinois at Urbana-Champaign, United States
Virginia Polytechnic Institute and State University, United States
University of Toronto, Canada
The University of British Columbia, Canada
Duke University, United States
Johns Hopkins University, United States
Arizona State University, United States
The University of Edinburgh, United Kingdom
National University of Singapore, Singapore
Indiana University, United States
University of Pittsburgh, United States
Eidgenössische Technische Hochschule Zürich, Switzerland
The Ohio State University, United States
North Carolina State University, United States
University of Colorado Boulder, United States
Northwestern University, United States
Tsinghua University, China
Washington University in St. Louis, United States
Fudan University, China
University College London, United Kingdom
University of California, Irvine, United States
Universität Wien, Austria
Peking University, China
Boston University, United States
University of Utah, United States
National Taiwan University, Taiwan
University of California, Santa Barbara, United States
Georgia Institute of Technology, United States
University of Massachusetts Amherst, United States
York University, Canada
University of Georgia, United States
Universidad Complutense de Madrid, Spain
University of Iowa, United States
California Institute of Technology, United States
Colorado State University, United States
Florida State University, United States
Rice University, United States
Nanjing University, China
Zhejiang University, China
Oregon State University, United States
Georgetown University, United States
The University of Tokyo, Japan
Washington State University, United States
McGill University, Canada
University of Oregon, United States
University of Alberta, Canada
Vanderbilt University, United States
Iowa State University of Science and Technology, United States
University of Waterloo, Canada
University of South Florida, United States
Brigham Young University, United States
Indian Institute of Technology Bombay, India
University of California, San Francisco, United States
Keio University, Japan
University of Nebraska-Lincoln, United States
Università degli Studi di Bologna, Italy
Shanghai Jiao Tong University, China
The Australian National University, Australia
The University of New South Wales, Australia
Universidad Politécnica de Madrid, Spain
Eötvös Loránd Tudományegyetem, Hungary
Technische Universität Berlin, Germany
University of Missouri, United States
Beijing Normal University, China
University at Buffalo, State University of New York, United States
University of California, Santa Cruz, United States
Simon Fraser University, Canada
The University of Hong Kong, Hong Kong
University of Kentucky, United States
Queen
University of Calgary, Canada
Monash University, Australia
University of North Texas, United States
University of California, Riverside, United States
Universidad de Granada, Spain
Freie Universität Berlin, Germany
Brown University, United States
The University of Tennessee, United States
The University of Melbourne, Australia
The University of Sydney, Australia
Norges teknisk-naturvitenskaplige universitet, Norway
Tufts University, United States
Università degli Studi di Roma La Sapienza, Italy
Dartmouth College, United States
George Mason University, United States
University of Victoria, Canada
Universitetet i Oslo, Norway
Univerza v Ljubljani, Slovenia
Syracuse University, United States
University of Science and Technology of China, China
Katholieke Universiteit Leuven, Belgium
Xi'an Jiaotong University, China
Humboldt-Universität zu Berlin, Germany
Wuhan University, China
Universidad de Buenos Aires, Argentina
The Chinese University of Hong Kong, Hong Kong
Universitat de Barcelona, Spain
Universiteit Twente, Netherlands
Georgia State University, United States
University of Delaware, United States
King Saud University, Saudi Arabia
Universidade de Brasília, Brazil
University of New Mexico, United States
Universidad de Sevilla, Spain
University of Glasgow, United Kingdom
Universidade do Porto, Portugal
Universität München, Germany
Trinity College Dublin, University of Dublin, Ireland
University of Auckland, New Zealand
George Washington University, United States
Université du Québec à Montréal, Canada
Emory University, United States
Rensselaer Polytechnic Institute, United States
Universiteit Utrecht, Netherlands
The University of Oklahoma, United States
Moscow State University, Russia
Indian Institute of Technology Madras, India
National Chiao Tung University, Taiwan
Linköpings Universitet, Sweden
Université Laval, Canada
Universität Heidelberg, Germany
Ceské vysoké ucení technické v Praze, Czech Republic
University of Tehran, Iran
Universität Freiburg, Germany
University of Kansas, United States
Drexel University, United States
Kungliga Tekniska högskolan, Sweden
University of Illinois at Chicago, United States
Temple University, United States
The University of Queensland, Australia
University of Miami, United States
Universität Hamburg, Germany
Technische Universität Wien, Austria
San Diego State University, United States
University of Ottawa, Canada
Imperial College London, United Kingdom
University of Rochester, United States
East China Normal University, China
The London School of Economics and Political Science, United Kingdom
University of Houston, United States
Universität Leipzig, Germany
Universitat de València, Spain
The University of Manchester, United Kingdom
Utah State University, United States
Universität zu Köln, Germany
Kyoto University, Japan
Portland State University, United States
University of Connecticut, United States
Universiteit Leiden, Netherlands
University of Leeds, United Kingdom
Rochester Institute of Technology, United States
École Polytechnique Fédérale de Lausanne, Switzerland
University of Applied Science and Technology, Iran
Université de Genève, Switzerland
Rheinisch-Westfälische Technische Hochschule Aachen, Germany
University of South Carolina, United States
Technische Universiteit Eindhoven, Netherlands
Huazhong University of Science and Technology, China
Virginia Commonwealth University, United States
University of Notre Dame, United States
Boston College, United States
McMaster University, Canada
Universitas Gadjah Mada, Indonesia
Technische Universiteit Delft, Netherlands
Louisiana State University, United States
UNIVERSITY_OF_LJUBLJANA
Dresden University of Technology
Mannheim University of Good Luck
Weriner Beisheim Schol of Thought
Univerza v Ljubljani
Malmö högskola
Technische Universität Dresden
Veterinary School of San Mateo
University of Ljubljana
Moscow Aviation College